{
  "contractVersion": "1.0.0",
  "eventId": "evt_synth_action_required_001",
  "eventType": "booking.confirmed",
  "occurredAt": "2026-08-09T12:11:00.000Z",
  "workspaceId": "ws_synth_tenant_001",
  "conciergeId": "cg_synth_001",
  "correlationId": "corr_synth_001",
  "causationId": "evt_synth_002",
  "actorType": "system",
  "actorId": null,
  "payload": {
    "bookingId": "bk_synth_002",
    "orchestrationStatus": "action_required",
    "invitationDeliveryState": "failed",
    "conferenceManaged": false,
    "joinUrlPresent": false,
    "actionRequiredReason": "zoom_or_calendar_incomplete"
  }
}
