{
  "contractVersion": "1.0.0",
  "eventId": "evt_synth_001",
  "eventType": "conversation.started",
  "occurredAt": "2026-08-09T12:00:00.000Z",
  "workspaceId": "ws_synth_tenant_001",
  "conciergeId": "cg_synth_001",
  "correlationId": "corr_synth_001",
  "causationId": "cause_synth_001",
  "actorType": "audience",
  "actorId": "aud_synth_001",
  "payload": {
    "channel": "web",
    "sessionId": "sess_synth_001"
  }
}
